{
  "$schema": "https://json-schema.org/draft/2020-12/schema",
  "$id": "https://github.com/tjsasakifln/Governance/control-center/contracts/schemas/agent-session.v1.schema.json",
  "title": "AgentSession v1",
  "description": "Agent context session. Agents consult by scope. requested_scopes minItems 1 — there is no implicit whole-company dump. granted_scopes is fail-closed.",
  "type": "object",
  "additionalProperties": false,
  "required": [
    "schema_version",
    "id",
    "agent_id",
    "requested_scopes",
    "granted_scopes",
    "purpose",
    "started_at",
    "ended_at",
    "status",
    "created_by",
    "include_directives",
    "include_snapshots",
    "include_attention"
  ],
  "properties": {
    "schema_version": { "const": "control-center.agent-session.v1" },
    "id": {
      "$ref": "https://github.com/tjsasakifln/Governance/control-center/contracts/schemas/primitives.v1.schema.json#/$defs/resource_id"
    },
    "agent_id": {
      "type": "string",
      "minLength": 1,
      "maxLength": 128,
      "pattern": "^[A-Za-z0-9._:@-]+$"
    },
    "requested_scopes": {
      "type": "array",
      "minItems": 1,
      "maxItems": 32,
      "uniqueItems": true,
      "items": {
        "$ref": "https://github.com/tjsasakifln/Governance/control-center/contracts/schemas/primitives.v1.schema.json#/$defs/scope"
      }
    },
    "granted_scopes": {
      "type": "array",
      "maxItems": 32,
      "uniqueItems": true,
      "items": {
        "$ref": "https://github.com/tjsasakifln/Governance/control-center/contracts/schemas/primitives.v1.schema.json#/$defs/scope"
      }
    },
    "purpose": { "type": "string", "minLength": 1, "maxLength": 500 },
    "started_at": {
      "$ref": "https://github.com/tjsasakifln/Governance/control-center/contracts/schemas/primitives.v1.schema.json#/$defs/utc_datetime"
    },
    "ended_at": {
      "$ref": "https://github.com/tjsasakifln/Governance/control-center/contracts/schemas/primitives.v1.schema.json#/$defs/nullable_utc_datetime"
    },
    "status": {
      "type": "string",
      "enum": ["open", "closed", "denied"]
    },
    "created_by": {
      "$ref": "https://github.com/tjsasakifln/Governance/control-center/contracts/schemas/primitives.v1.schema.json#/$defs/actor_ref"
    },
    "include_directives": { "type": "boolean" },
    "include_snapshots": { "type": "boolean" },
    "include_attention": { "type": "boolean" }
  },
  "if": {
    "properties": { "status": { "const": "denied" } },
    "required": ["status"]
  },
  "then": {
    "properties": {
      "granted_scopes": { "type": "array", "maxItems": 0 }
    }
  }
}
